strategy,score,outage,percentile_10_db,peer_tiebreak,capped,evaluated_combinations,final_candidate_ids
central_massive_mimo,-1.1919250825038596,0.18391123439667129,-22.127264980574303,9.834940092152696,False,0,roof_Blok_A
distributed_fixed,0.5440930818692519,0.04410540915395284,7.495156305529935,21.344067574670795,False,0,wall_Blok_B_04_02 wall_Blok_L_00_00 wall_Blok_P_00_00 wall_Blok_P_00_01 wall_building_452650244_00_00 wall_building_452653890_01_01
distributed_movable,-0.3068020484838217,0.14674063800277393,-7.7622771830967645,22.80524486737904,False,30561,wall_Blok_F_02_01 wall_Blok_L_1_00_00 wall_building_452653879_12_01 wall_building_452653880_00_00 wall_building_452653890_01_01 wall_building_452653892_00_00
distributed_movable_optimization_2,1.603190899274449,0.01872399445214979,24.49319790655444,39.72549983988766,False,30561,wall_Blok_A_01_01 wall_Blok_A_02_01 wall_Blok_A_03_01 wall_Blok_D_02_00 wall_Blok_E_07_01 wall_Blok_L_1_00_00
distributed_movable_optimization_3,1.1294849610788593,0.04424410540915395,16.330518387665943,35.7203147104716,False,30561,wall_Blok_A_01_01 wall_Blok_A_02_01 wall_Blok_D_02_00 wall_Blok_E_07_01 wall_Blok_E_07_02 wall_Blok_H_00_00
